{
	"id": "fb_2",
	"processEntryId": "pe_77Ab",
	"jobId": "dev-react-senior",
	"jobName": "Dev React Sênior",
	"companyName": "Acme Tecnologia",
	"stage": "not_selected",
	"message": "Seguimos com pessoas com mais tempo liderando times de frontend. Sua trajetória em React chamou atenção, e a vaga de Pleno que abre em novembro combina com o seu momento.",
	"reasonCode": "insufficient_experience",
	"nextStep": null,
	"sentAt": "2026-09-30T12:00:00-03:00"
}
